{
  "schema_version": "1.0.0",
  "camera_path_id": "ZM-01",
  "coordinate_system": "right-handed-y-up",
  "interpolation": "hold",
  "keyframes": [
    {
      "time": 0.0,
      "eye": [
        3.3,
        1.8,
        3.0
      ],
      "target": [
        1.0,
        0.5,
        0.5
      ],
      "up": [
        0.0,
        1.0,
        0.0
      ],
      "fov_degrees": 40.0,
      "note": "macro chamber context"
    },
    {
      "time": 2.0,
      "eye": [
        3.3,
        1.8,
        3.0
      ],
      "target": [
        1.0,
        0.5,
        0.5
      ],
      "up": [
        0.0,
        1.0,
        0.0
      ],
      "fov_degrees": 40.0,
      "note": "divider opening"
    }
  ]
}
