{
  "schema_version": "1.0.0",
  "camera_path_id": "ZM-02",
  "coordinate_system": "right-handed-y-up",
  "interpolation": "linear",
  "keyframes": [
    {
      "time": 2.0,
      "eye": [
        3.3,
        1.8,
        3.0
      ],
      "target": [
        1.0,
        0.5,
        0.5
      ],
      "up": [
        0.0,
        1.0,
        0.0
      ],
      "fov_degrees": 40.0,
      "note": "start macro"
    },
    {
      "time": 4.0,
      "eye": [
        2.4,
        1.2,
        2.0
      ],
      "target": [
        1.0,
        0.5,
        0.5
      ],
      "up": [
        0.0,
        1.0,
        0.0
      ],
      "fov_degrees": 37.0,
      "note": "volume to display particles"
    }
  ]
}
