{
  "schema_version": "1.0.0",
  "camera_path_id": "scene-hero-frozen-v0",
  "coordinate_system": "right-handed-y-up",
  "interpolation": "catmull_rom",
  "keyframes": [
    {
      "time": 0,
      "eye": [
        7,
        3.5,
        6
      ],
      "target": [
        2,
        1,
        1
      ],
      "up": [
        0,
        1,
        0
      ],
      "fov_degrees": 38,
      "note": "hero start"
    },
    {
      "time": 7.5,
      "eye": [
        4.5,
        2.2,
        3.8
      ],
      "target": [
        2.5,
        1,
        1
      ],
      "up": [
        0,
        1,
        0
      ],
      "fov_degrees": 34,
      "note": "hero approach"
    },
    {
      "time": 15,
      "eye": [
        7,
        3.5,
        6
      ],
      "target": [
        2,
        1,
        1
      ],
      "up": [
        0,
        1,
        0
      ],
      "fov_degrees": 38,
      "note": "hero return"
    }
  ]
}
