{
  "schema_version": "1.0.0",
  "camera_path_id": "ZM-04",
  "coordinate_system": "right-handed-y-up",
  "interpolation": "hold",
  "keyframes": [
    {
      "time": 6.5,
      "eye": [
        2.7,
        1.5,
        2.3
      ],
      "target": [
        1.0,
        0.5,
        0.5
      ],
      "up": [
        0.0,
        1.0,
        0.0
      ],
      "fov_degrees": 40.0,
      "note": "fixed conversion comparison"
    },
    {
      "time": 8.0,
      "eye": [
        2.7,
        1.5,
        2.3
      ],
      "target": [
        1.0,
        0.5,
        0.5
      ],
      "up": [
        0.0,
        1.0,
        0.0
      ],
      "fov_degrees": 40.0,
      "note": "locked end"
    }
  ]
}
