{
  "schema_version": "1.0.0",
  "camera_path_id": "hero-placeholder",
  "coordinate_system": "right-handed-y-up",
  "interpolation": "hold",
  "keyframes": [
    {
      "time": 0.0,
      "eye": [
        5.0,
        2.0,
        5.0
      ],
      "target": [
        0.0,
        0.0,
        0.0
      ],
      "up": [
        0.0,
        1.0,
        0.0
      ],
      "fov_degrees": 40.0,
      "note": "placeholder only; replace after V3"
    },
    {
      "time": 1.0,
      "eye": [
        5.0,
        2.0,
        5.0
      ],
      "target": [
        0.0,
        0.0,
        0.0
      ],
      "up": [
        0.0,
        1.0,
        0.0
      ],
      "fov_degrees": 40.0,
      "note": "locked end"
    }
  ]
}
